subtitle,title,url,text,tags,date
,Socialight – Location Aware Application,https://techcrunch.com/2005/10/20/socialight-location-aware-application/,"Socialight , that launched yesterday, is a mobile location aware application that allows you to take notes about places you go by in the street so that when your friends go around the same place get notifications on their cellphones about your notes. Their about page reads: The idea of overlaying information on top of the real world by tagging and noting real places, while still connected to a social tissue (it’s your friends that get access to the information) is something that i’m particularly interested about. If it’s going to pick up or not is what we’ll see, but it’s nice to see helpful information pop into your familiar places.",,2005-10-20 00:00:00
,Flock Has Launched,https://techcrunch.com/2005/10/20/flock-is-launching-publicly-today/,"I just heard from Geoffrey Arone at Flock that they will be launching it to the general public within 3 hours (by 5 pm PST). Feedback to their recent beta expansion has been so positive, Geoffrey tells me, that there is no reason to delay any longer. Congratulations Flock! I imagine tens of thousands of people will be downloading and using their product by end of day. Make sure you upload your del.icio.us bookmarks and try out the blogging tool. UPDATE : Flock is now live:",Flock,2005-10-20 00:00:00
,Ojos Is Now Riya,https://techcrunch.com/2005/10/20/ojos-is-now-riya/,"Ojos , which never owned ojos.com (they used ojos-inc.com) has found a permanent name – Riya . More on this on the Munjal Shah’s blog and Tara Hunt’s blog . Riya has a facial and text recognition technology that automatically tags photos with who’s in them. We profiled them earlier . Riya is preparing to start their private alpha and will hopefull launch within a couple of months. If you are interested in participating in the alpha, email alpha@riya.com. During the alpha they will only support IE6.",Riya,2005-10-20 00:00:00
,Top Five Web 2.0 Venture Capitalists,https://techcrunch.com/2005/10/19/top-five-web-20-venture-capitalists/,"Most venture capitalists don’t understand tagging, blogs, rss, ajax, or the two way web. They scoff at social bookmarking sites and think podcasting is a fad (maybe it is). They desparately “want in” to this renaissance of the web, but can’t be bothered to open up the simplest RSS reader and understand the power of decentralized content. In short, they don’t get it. Most traditional VC funds have a single web-focused partner, who may or may not be interested in web 2.0 consumer companies. For the most part, these VCs are not part of the most interesting deals. If they do get what you are pitching, they want to pump way more money into the company than makes sense. Here’s my attempt to point out the venture capitalists who do get it . Some of these have new funds and only recently became venture capitalists. Some of them have been around forever. There are just two personality traits all share. First, they understand that a fundamental shift has occured in web evolution. Second, they are hungry as hell to find deals, and spend more time proactively looking for the next opportunity than they do sitting back and looking at the business plan stream that naturally flows into any venture fund. This list is purely subjective. It’s blatantly biased. Some VCs don’t belong and many who do are left off. But it’s a list, nonetheless, that I’ve come up with over the last few weeks of interviewing entrepreneurs, venture capitalists and journalists. David Cowan is a partner at Bessemer Venture Partners and writes a blog called Who Has Time For This . He’s on this list partially because he incubated the hottest and most anticipated company on the web right now, Flock. This guy picks winners. Of 43 early stage investments, 19 have gone public and 16 have been acquired. It could be because of his education – he has the killer combination of a math/CS degree and a MBA from Harvard. Tim Draper invested in Skype. Done. He also sits on the board of SocialText, and his fund was in Baidu. Tim will go anywhere in the world for the right deal. Most VC’s with 1/10th his net worth won’t leave silicon valley for a board meeting. David Hornik is is a General Partner at August Capital and writes a blog that has over 10,000 RSS readers. David best asset is that he knows everybody . He’s the kind of guy you want to drink beers with while watching a football game.  If you are his friend, he’ll happily introduce you to anyone, and often puts two people together just because he thinks they should know each other. He’s invested in companies that are defining the web today: SixApart and Technorati among them. And even if he doesn’t invest, he’ll do more than most VCs who have invested to help you. Here’s just one example – take a look at the things he says about Pandora , which isn’t a portfolio company. David has told me on numerous occasions that “the web is an ecosystem” and that he wants to play his part in making it healthy. He certainly does. Josh Kopelman, through FirstRoundCapital , is quietly filtering through just about every young web 2.0 company, and investing in many of them. Josh has a Wharton MBA and was the founder of Half.com, which was sold to ebay in 1998. His investments include Feedster, LinkedIn, Del.icio.us and, reportedly, Browster (and others). Josh understand web 2.0 better than most entrepreneurs. His experience as an entrepreneur and growing huge businesses out of whole cloth is an incredible asset. Fred Wilson is a founding partner of Union Square Ventures and writes the extremely popular A VC . If you are new to web 2.0, start with his Blogging 1.0 post. Then read the rest of his blog (even the stuff about music). Fred was the original lead investor in del.icio.us, back when people were still scratching their heads about it. That enough gets him on the list. But Union Square’s other investments , including indeed, could also be major home runs. It’s clear from his blog and what people say about him that he spends a lot of time working with his portfolio companies. He’s the kind of guy you want on your side when you go into battle. Jeff Clavier – Jeff is a former VC and still makes the odd angel investment (Feedster, Truveo, and a few others). His new venture allows him to work with pre-funding companies and get them ready for prime time. In the last year, he’s worked with Userplane, Buzznet, UltraDNS, Glenbrook Networks, Loomia and two other undisclosed companies. If you have a hot idea and need advice, funding, introductions and anything else, Jeff may just take you on as a client and do what it takes to help you be successful – but like a VC, he’ll have to be convinced of your potential. Brad Feld – Brad is a managing director at Mobius Venture Capital and writes a must-read web 2.0 blog called Feld Thoughts. Read his posts on Term Sheets if you are in the process of raising capital. I keep trying to meet him but haven’t yet. Brad’s investments include invested in NewsGator, Feedburner and Technorati. O’Reilly AlphaTech Ventures – This is the only non-person on here. OATV just closed a $50 million fund to invest in young companies. Given the incredible access Tim O’Reilly has to these companies, OATV could quickly become an important fund in the web 2.0 space. Pierre Omidyar – Pierre founded ebay and is the Co-founder of Omidyar Network , where he’s invested in a number of interesting companies including EVDB, SocialText and Feedster, plus a few undiscloseds. And it’s always good to have a multi-billionaire on your side. Peter Rip – Peter is a founding partner of Leapfrog Ventures , a $100 million fund. Peter also writes Early Stage VC , another must-read blog. His investments include ojos, an incredible new photo-metadata service that is going to be extremely disruptive (and useful). Like others in this post, he’s a guy I’d want on my board. He’s gone through many battles as an entrepreneur in his time (he founded his first company in the early 80’s and worked at Infoseek in the late 90’s). Peter Thiel – Peter, the former CEO of paypal, has invested in LinkedIn, Friendster, LinkedIn and other web 2.0 companies. He’s just created the Founders Fund . Can’t wait to see what investments come out of it. There are three additional VCs that are yet to make notable investments. But they are laser focused on the space and are hungry to make investments in web 2.0 companies. You will find them at every event and seem determined to make a name for themselves. I include them here now because Ithere’s a good chance that when I update this list in a year, they’ll be at the top. Thomas Ball – Tom is a Venture Partner at Austin Ventures, a fund with $3 billion under management. He’s their consumer and web 2.0 guy and seems to be spending a lot of time in Silicon Valley and at web 2.0 events.  Prior to joining AV, Tom was an entrepreneur who founded a couple of successful Internet companies.  This adds a unique perspective to his investing philosophy in web 2.0.  He works actively with a number of AV portfolio companies including Pluck and, I suspect, will be making important investments in web 2.0 in the near future. Dan Grossman – Dan is a principal at Venrock Associates and has recently started a great blog called A Venture Forth (where he wrote a much bookmarked post on Ajax ). Prior to Venrock, Dan was at Garage.com. You’ll also find Dan at most web 2.0 conferences, and he’s made a huge effort to reach out to the community and network. Jason Pressman – Jason is a principal at Shasta Ventures, a young $200 million fund that has a deep commitment to and expertise in consumer-focused businesses. Jason was at Walmart.com and was part of a small group of executives that ran the place before coming to Shasta – he was VP of Strategy, Operations and Business Development. He has a keen insight into web 2.0 and has served as an advisor to a number of companies in the space. Jason knows how to grow startups to massive scale, and he is always thinking about which new companies he can help to achieve that scale.",,2005-10-19 00:00:00
,Update: Techcrunch Party This Friday,https://techcrunch.com/2005/10/19/techcrunch-party-this-friday-2/,"We are proud to annouce the sponsors of the third TechCrunch party this weekend. Thank You:  Edgeio , Flock , Goowy , Loomia , Pandora , Real Travel , Shasta Ventures , Simply Hired , Wink , Zazzle . If you plan on attending, please sign up on the Wiki . Demos start at 6 pm sharp. We are going to reduce the demo time to 15 minutes to get more companies in. At 7 pm we’ll take a 15-20 minute break for toasts and a keynote by Dave Winer . I’m pretty fired up about these demos. Some of the companies, like Sphere (and to some extent Flock ), will be showing their stuff in public for the first time ever.",,2005-10-19 00:00:00
,Web2.0 Or Not?,https://techcrunch.com/2005/10/18/web20-or-not/,"This is too good not to post. Web2.0 or Not? is the tongue-in-cheek, hugely sarcastic and quite funny creation of Ryan King and Eran Globen . Yeah, its HotOrNot for Web 2.0 companies. These two guys, who by the way are brilliant engineers (Ryan consults with Technorati, Eran works at Jeteye), have been keeping things lively with their various projects, another of which is Supr.c.ilio.us , which describes itself as “social social tagging site tagging”. The top tag is “tagging”. Yeah, they’re making fun of the rest of us. Read their blog post on the Slide party last weekend as well. All I can hope is that these guys continue to do what they are doing. And yes, we’ve added TechCrunch to Web2.0OrNot to see what people think. :-)",,2005-10-18 00:00:00
,Techcrunch Party This Friday,https://techcrunch.com/2005/10/18/techcrunch-party-this-friday/,"We are having our next TechCrunch party in Atherton this Friday (October 21) afternoon and evening. Sign up here . Our last meetup drew about 100 entrepreneurs, venture capitalists, bloggers and beer drinkers, and I am hoping this one will draw at least that number. We are changing to a socialtext wiki and it will be up later today along with a confirmation post. Please email us now if you would like to demo your product. We have 8 slots. We are also taking up to two additional corporate sponsors – this allows us to keep this event free. Email us if you are interested. Package includes right to put up a banner, a toast/speech of up to 2 minutes and your logo on an event tshirt. Plus the happiness of knowing that people will love you and your company. :-) UPDATE:  This is 100% on. Wiki with information and signup area is here . We need two additional sponsors to the two we have already. If you want your logo on the tshirts (free to everyone), we need to get confirmation of sponsorship by end of day today. Sorry for the complete lack of notice. The cost is $250 and will defray tshirt and catering costs. UPDATE #2: Sponsors include Simply Hired , Flock and Goowy . THANK YOU very much. One spot left. I need help with tshirt logistics (company, timing, etc.).",,2005-10-18 00:00:00
,Want To Buy A Search Engine?,https://techcrunch.com/2005/10/18/want-to-buy-a-search-engine/,"The founders of Jux2 , a great metasearch engine, put it up for sale on ebay yesterday. John Battelle wrote about this yesterday as well. Aaref Hilaly, one of the founders (and a friend) emailed to tell me about it, saying that the founders just don’t have enough time to put into the project and deal with growth. Starting price? $0.01, with no reserve. Current price? $26,100 with 7 days left. Jux2 won Search Engine Watch’s best metadata search engine award earlier this year. It’s an excellent way to view the big search engine results side-be-side, and has a very clean and usable interface.",,2005-10-18 00:00:00
,Web 2.0 This Week (October 9-15),https://techcrunch.com/2005/10/17/web-20-this-week-october-9-15/,"Tons of new companies launched this week. My guess is they were aiming for the Web 2.0 Conference last week but had to delay. This may have worked out for the best as the covereage they received was probably much better after the press chaos last week. Most bloggers have probably noticed that Dave Winer is back in the bay area. It’s good to have his brain around here again. I’ve been invited to a couple of his weekly breakfasts with Steve Gillmor. I try to keep my mouth shut and keep my listen to talk ratio as high as possible. These guys aren’t always right, but they’ve seen and done enough that even when they’re wrong, you can learn a lot by being around them. We said goodby to Richard MacManus , who stayed with us for during his trip to silicon valley. Based on how warmly he was received, my expectation is that Richard will be back soon. His eloquent goodbye post was excellent. We launched something called the Web2.0WorkGroup last week. It’s an experimental sandbox that a bunch of bloggers focused on writing about the new web are working on. Right now its a directory of participating blogs. Soon it will be much more. Here’s this week’s wrapup: Kahuna (update), Gada.be , Google Reader (update), Yahoo Blog Search , Google Bookmarks , Wink , MeasureMap (update), Memeorandum (update), Yelp , Qumana (update), RememberTheMilk , Sphere (update), PreviewSeek , Reading Lists , Inform Smart: Give the blogosphere an exclusive preview and announcement rights of your new product and let the accolades roll in . Dumb: Launch a product that breaks Firefox, ignore blogger input and give the New York Times an exclusive . Bloggers respond . Blog Herald reports that there are over 100 million blogs. Breakdown by country. Awesome. The BBC also reports that the web has grown more this year than ever before. Dave Winer is interviewed by Robert X. Cringley on Nerd TV. It’s a big download but worth it. I’m glad stuff like this is being recorded for historical purposes. It’s a cross between a rant and a classic essay , and it’s important. He’s continuing his theme of comparing search results on the existing blog search engines. Everyone said search was “good enough” before Google. Blog search isn’t even “good enough”. Massimo Curatella takes the time to list large-file sharing apps. Bookmark it. Oodle got it right when they went for the decentralized content approach. Craigslist felt threatened and turned them off. Oodle responds diplomatically. This is not great for Oodle, but I also think it’s not great for Craigslist. Data must be open. Sites that try to horde it will lose in the end. Fred Oliveira writes about Tagging , with a focus on why people tag. I hope he’ll still be in the bay area for Tag Camp on October 28 to share his ideas with that group. A post by Chris Pirillo launched a huge blog discusson on splogging and the fact that BlogSpot seems to be the main source of it. Google owns BlogSpot and has a clear incentive to allow this to happen – they serve ads on every one of these splogs. This is not a new problem. Google needs to take action. Dave took the first step . Yesterday he reached out again . These two guys need to work together to make the blogosphere and the web a better place to hang out. I hope they find a way.",,2005-10-17 00:00:00
,Healthline – Reliable Medical Information,https://techcrunch.com/2005/10/17/healthline-reliable-medical-information/,"HealthLine , a very smart medical search engine with web 2.0 features, launched this evening. Tony Gentile, HealthLine’s VP Product Management, writes about it here . First, its a good search engine. Normal language is translated into medical terms, and refinement options are shown for related information. For instance, a search for breast cancer shows refinement options for “treatment” and “symptoms”, as well as links to the broader search of “cancer”. The HealthMaps feature is incredibly useful. It is a visual display of information relevant to your query. Do a search for “ cancer ” and click on the top left link just above the first result to see this. Clicking on any of the visual cues will give additional refined information. You can also see the HealthMap feature in the screen shot above. Refinements, along with HealthMaps, is a very good way to find relevant information with a single search on a term even loosely related to the information you are looking for. Healthline also offers browsing by channel, with topics ranging from Acne to Yeast Infections. If you become a member, you can create news alerts, and tag and save search results. You can also write reviews of articles and rate other reviews . This is an excellent resource.",,2005-10-17 00:00:00
,Goowy Charges Ahead,https://techcrunch.com/2005/10/17/goowy-charges-ahead/,"Alex Bard’s flash-based desktop replacement Goowy , based in San Diego, has impressed me from the start. We originally profiled Goowy on August 17, 2005 and again a couple of weeks ago. Today Goowy released further functionality. First, they increased storage from 100 MB to 2 GB . While that storage is only for use with email now, they will soon be releasing a virtual file storage product, allowing users to really put that 2 GB to work. Second, Goowy released a flash-based desktop application that allows you to access core Goowy features without going to the site. Email notifications, RSS updates, calendar items, etc. are included. The look and feel is very much like Konfabulator , but we’ve noticed no performance issues on our machine as we did with that service. If flash is your thing (and maybe even it if isn’t), Goowy is for you. Let us know what you think of it.",Goowy,2005-10-17 00:00:00
,"Flock'S Refines Features, Expands Beta",https://techcrunch.com/2005/10/17/flocks-supercool-features-expanded-beta/,"Flock ‘s CEO Bart Decrem expanded the beta over the weekend to 1,007 people, most of whom are now blogging about it. The product, which was good back in August when I first tested it , is even better today. I’m a big supporter of Flock. I am even writing this post while wearing a Flock tshirt. Flock is definitely the Flickr of browsers. :-) The three most powerful tools Flock offers it’s users are bookmarks, blogging and a RSS reader. They’ve dropped their propreitary bookmarking engine and have replaced it with del.icio.us. I have a ton of del.icio.us bookmarks – thousands – and it took a while for the browser to chug through them all during the import procedure. But it did, and I now have one hell of an interface into my favorite bookmarking service. Since Flock supports tabbed browsing, I can keep bookmarks open in a separate tab and refer back whenever. Partnering with Del.icio.us is brilliant. I do not know if they have plans to integrate with other social bookmarking sites, but I imagine it would be fairly simple for them to do. The blogging tool was, and remains, absolutely the best I’ve seen. This tool brings flickr pictures directly into the blog tool, allowing simple drag and drop into the post. It’s dual-pane, with both wysiwyg and html interfaces (I actually preferred the old toggle method of changing from html to wysiwyg, but I’m not complaining). Setup is very simple. It just works. Flock also has a built in RSS reader that is both dead simple to use and yet powerful enough for heavy users. A simple drop down box can be accessed for any page that allows you to grab the feed for the page you are currently on, and add it to an existing or newly created folder. Feeds can be tagged, and the viewer allows for expanded or collapsed feed viewing. There are some speed issues with this version, 0.5, but in my opinion it has more than enough features to convince web users by the millions to switch from their default browser and go with Flock. Let’s launch this thing!",Flock,2005-10-17 00:00:00
,Previewseek – New Web Search Engine,https://techcrunch.com/2005/10/16/previewseek-new-web-search-engine/,"PreviewSeek is a new London-based search engine created by Chris Hong that is very quietly impressing people with a number of innovating features. Basic search results are great but nothing to get overly excited about. The useful features include disambiguation of queries (are you searching for “apple” the fruit, or “apple” the computer”?), preview of search pages (think Browster), and better refining of searches. PreviewSeek does a good job at attempting to determine meaning from a query. Type in “ Java ” and you get a result set with a numer of options for the query, including the island, the programming language, and even the coffee. This is my favorite feature. PreviewSeek allows you to preview search results in much the same way as Browster (our profile ), except without the download and the ads. It’s a great way quickly scan results without actually clicking away from previewseek. For any given query PreviewSeek will suggest a number of refinement options on the left sidebar, which greatly assist in drilling down on a particular search.",,2005-10-16 00:00:00
,My Thoughts On Reading Lists,https://techcrunch.com/2005/10/16/my-thoughts-on-reading-lists/,"Dave Winer has been thinking about, and recently writing about, a new idea: Reading Lists. OPML is a really useful file structure that just about everyone who uses a feed aggregator, like bloglines, is already using without necessarily knowing it. Most readers keep subscribed feeds for a user in OPML format, for easy importing and exporting. If you export your OPML feed you get a XML file of your feeds, which other feed readers understand. The problem with opml files from readers is that they are static, meaning I can give you my OPML file but you will never know if I add or delete feeds unless I tell you and give you the new file. All you get is a snapshot of my feeds from the moment that I share my file with you. Dave thinks these files should be dynamic, which means that I can share my opml file, or as he calls it my reading list , and anyone who subscribes to it will always have the current version, no matter how often I amend that list. There is very little technology needed to allow this to happen – the various feed readers simply need to agree to support dynamic lists and allow people to share them permanently. Dave’s trying to make this happen. If he succeeds, we’ll all be able to subscribe to reading lists from people we trust on a given subject, and good feeds will be that much easier to find. Fred Oliveira wrote about this recently as well. In a comment, Eric Lin writes: Yeah, exactly. As soon as people start to think about this idea, a lot of other interesting ideas start to spring up. A real world example of where we need this is our Web2.0WorkGroup . Feeds for each blog are linked, and we have a static OPML file that we are updating as new feeds join. However, because the file is static, anyone who downloads the file has to check back frequently as new feeds are added. Let’s automate this process.",OPML_Editor,2005-10-16 00:00:00
