subtitle,title,url,text,tags,date
,Kaboodle Launch: Bookmarking + Wiki,https://techcrunch.com/2005/10/25/kaboodle-launch-bookmarking-wiki/,"Kaboodle opened its doors this afternoon for an official launch on Wednesday. I met with Manish Chandra, the CEO, earlier today for a walk through and came away very impressed. In addition to Manish, Kaboodle’s founders include Keiron McCammon and Chetan Pungaliya. Kaboodle is a free social bookmarking service. And it really does take things to the next level in terms of usefulness, particularly for certain types of stuff. For instance, Kaboodle really shines when bookmarking ecommerce content. The first thing to do after registration is add a kaboodle button to your browser. When you click to bookmark content, you are redirected to Kaboodle where you select a “page” (topic). Content is auto-selected, including an image. A click lets you change or add to the content and/or select a new image. Once you’ve added content to a page you can choose to make it public or private, and share it with others. New content can be added to a page from other sites. Each piece of content can be rated by others, and free-text comments can be added. It is an excellent way to collaborate with others in comparing and contrasting related content. In fact, in many ways Kaboodle reminds me of a wiki once the collaboration on a page begins. Coming soon functionality includes page badges, search and RSS for users and pages. I’d also like to see tagging functionality added to pages and individual pieces of content. Om Malik wrote a lengthy post on Kaboodle a few hours ago. In my opinion Manish Chandra and the rest of the team have done a great job rolling this out. They are talking to bloggers and mainstream press simultaneously, and the site is a textbook example of how to walk new users through how the service works. They’ve thought through launch strategy and usability in a very intelligent way.",,2005-10-25 00:00:00
,Annotating Your Web With Stickis,https://techcrunch.com/2005/10/24/annotating-your-web-with-stickis/,"In 1999 Eng-Sion Tan launched a company called Third Voice, a browser plug-in that created a sidebar on web pages and allowed surfers to annotate the page by adding their comments. The service quickly devolved into web graffiti and shut it’s doors two years later. Even though Third Voice is gone, the idea had some value. And soon Jean Sini and Marc Meyer will be launching something that has some of the characteristics of Third Voice, but which will not have the same graffiti result. They call it Stickis . Stickis is still in private alpha. I don’t have credentials yet (they are keeping it very quiet and don’t want screen shots on the web), but Marc and Jean came by last week to give me a peak at the service. You can request an alpha invitation on their home page . To be honest, it took me a while to get it. The reason: they’ve built a platform that has at least two or three killer applications and I saw so much in so short a time that I was getting lost. I slowed things down by asking dumb questions and, in the process became pretty fired up about stickis in general. Once you are registered, you can add a “sticki” to any web page with your notes, which can be in the form of text or dragged in images. Every time you return to that page you can pull up your sticki. For lots of sites that I interact with, the ability to keep these notes is very interesting. Notes can be shared with friends or kept private. You can also subscribe to feeds from other sites, and if those feeds have linked to the current site you are visiting that content will also appear in the stickis. For instance, If you were to go to the Sticki site, and you had subscribed to the TechCrunch feed, you would see this post included in the sticki. They’ve also included a master page to manage the content you’ve distributed on various pages, and add feeds and friend’s content. Marc and Jean are in the process of raising an angel round – everything to date has been created on their own dime and with their own time. They’ve been working on it for about a year.",,2005-10-24 00:00:00
,A Second Look At Inform.Com,https://techcrunch.com/2005/10/24/a-second-look-at-informcom/,"We hammered on Inform.com last week following their launch and a fluffy article in the New York Times. Inform.com’s goal is to provide a useful news interface – both blog and non-blog – and to show the interconnectedness of all of the content. We had a number of concerns with the service. It’s a full page popup to ensure that they entirely control the user experience. It doesn’t work properly in Firefox. You are limited to reading the content they provide (you can’t add content they haven’t included in the service). The scroll button on the mouse doesn’t work. Etc. I received an email from Julian Steinberg, the project manager at Inform, a few days after my initial post. He offered a point-by-point response to each of my criticisms. We followed up with a phone call today. I am re-printing his email below (with his permission), and I want to point out a few positive aspects of the service as well that I discovered after he walked me through it. This was a reasonable and articulate response to a fairly aggressive post. And other than the scroll wheel funtionality (it doesn’t work), his counterpoints are good ones. Here’s what I learned from the walk through: This is a beta, so thin content is excusable. They do an excellent job of relating content to other content via topics (basically keywords). They do a great job with filtered tagging (searching across multiplie keywords like “miami” and “football”), something no real time search engine does today and which is a really useful way of drilling down into new content. You can also toggle on/off blog and non-blog news. New feature releases over the next couple of months include a video seach and viewing tool, better firefox integration and the ability to add feeds that are not currently already included at Inform. I’m looking forward to all of this.",Inform.com,2005-10-24 00:00:00
,Del.Icio.Us Expands Search Feature,https://techcrunch.com/2005/10/24/337/,"Fred Wilson reports that Del.icio.us has extended its existing user-only search to everyone. Previously search was available only if you were logged in to your del.icio.us account. Check it out on any del.icio.us page, including here . Joshua Schachter has not yet written about this on the del.icio.us blog . Search functionality has also been expanded. In addition to showing your own results in addition to everyone else’s, you can search using “and” (such as apples and oranges) to drill down into more relevant results. Results are returned if the query term is contained withint the title of the bookmark and/or within tags. UPDATE : Per Joshua’s comments below (the founder of del.icio.us), del.icio.us comments are also searched. You can use “tag:tagname” to just search tags. If you are going to do multiple tag search, AND must be capitalized. I like the extended functionality a lot. David Weinberger also posts some very interesting del.icio.us stats.",del.icio.us,2005-10-24 00:00:00
,The Postsecret Book,https://techcrunch.com/2005/10/23/the-postsecret-book-cometh/,"Frank Warren the creator of the increasingly popular postsecret website is now coming out with a book entitled PostSecret : Extraordinary Confessions from Ordinary Lives . Postsecret has been a favorite site of mine. I wrote about it back in July (getting their permission to post more than a single image).  Thousands of people have sent postcards that tell a secret fear, regret, hope, fantasty, betrayal, confession, hope or experience. Some of them are touching to the point of incredible sadness or elation. The site is wonderful. The rules?  “Reveal anything – as long as it is true and you have never shared it with anyone before”. Preorder the book here .",PostSecret,2005-10-23 00:00:00
,Thank You For Coming To Our Party,https://techcrunch.com/2005/10/22/thank-you-for-coming-to-our-party/,"I believe we had as many as 200 people here last night for TechCrunch Meetup #3 . The last of the guests left at 4 am. Thank you to everyone who came and everyone who tried to attend via festoon. Scott Beale took my favorite picture of the event. Here’s my second favorite : Kevin Burton hard at work on TailRank – using my oven as a desk. Thanks to our very generous sponsors we were able to cater the event and provide t-shirts for everyone. You can also purchase a tshirt directly from Zazzle. There were too many demos but they were all excellent . It was exciting to see the first public view of Sphere, and meet some of the entrepreneurs behind the other companies as well. Thank you to everyone who took the time to show us their products. Dave Winer gave a rousing keynote that got everyone fired up. People are calling it the Flickr of keynotes . The always cool Marc Canter and his wife were in costume (picture also shows Keith Teare). Robert Scoble was here for hours and barely left the back room where we were showing raw demos of the really young companies, including edgeio . VCs were roaming the party, looking for the next great investment. Google, Yahoo and ebay all had product managers, developers and business development people quietly talking to entrepreneurs. Scott Beale, Tara Hunt and others were taking pictures of everyone and everything (Flickr tag for your photos is “techcrunch” – please post them!). It was Web 2.0 perfection. The only problem was the whole festoon remote participation idea didn’t work out at all. People couldn’t see or hear anything. Someone created a very funny festoon image and defaced the wiki this morning. Instead of deleting it, we kept it up . That kind of creativity shouldn’t be deleted. We’ll get it right next time. :-) Then there was the whole keg situation. We never did get the damn thing to produce beer, even after a number of geeks and ex-bartenders went to work on it . Clearly we didn’t have the right kind of geeks at the event (via Marc Brown ). The best thing about these parties is that we all get the chance to get to know each other a little bit better, and intensely cross-pollinate ideas. I am keeping a running directory below of blog posts and pictures from the event. Please email me if you’ve written about it with the link. Pictures (tag: techcrunch), Dave Winer , Robert Scoble , Matt Marshall/SiliconBeat , Marc Canter , Marc Canter #2 , Scott Beale , Tara Hunt , Ethan Stock , Narendra Rocherolle , Susan Mernit , Richard MacManus (you were here in spirit Richard), Ben Barren , Russell Limprecht , Bhagvan Kommadi , John Furrier , Allthatscool , Andrew Woolridge , Jared Cosulich , Sylvia Paull , InTheCrowd , Alex Moskalyuk (good overview of demoing companies), Zoli Erdos (great idea on people bringing their own nametags…Jeff Clavier did this).",,2005-10-22 00:00:00
,Ma.Gnolia: More Social Bookmarking,https://techcrunch.com/2005/10/22/magnolia-more-social-bookmarking/,"I’m looking forward to seeing what ma.gnolia is all about. It appears to be a social bookmarking service with a twist of some sort. I hope its a good twist because this space is getting a bit crowded to say the least. Ma.gnolia describes itself as “Found is the New Search” and “Social Bookmarking to build an information community online”, adding: They promise a beta in December 2005. I’m skeptical of companies that continue to launch with these domain name abominations (dropping vowels, using random ccTLDs and lots of extra dots), but if the service rocks, I will forgive all. Early buzz sounds promising.",,2005-10-22 00:00:00
,Windows Live Email Service,https://techcrunch.com/2005/11/25/windows-live-email-service/,"Domains.Live.com is a free new email service offered by Microsoft. It’s a simple but very useful tool. And, like Office Live , it is disruptive to the existing domain name registrar market (are they even paying attention?). So the basic service is this: Microsoft will host email and instant messaging for you in a domain you own. More details on the Custom Domains blog . Here are my thoughts: First of all, this is great. Until now, generally only domain name registrars offered this kind of service, and it was both costly and had a very web 1.0 interface. Second, when I look at services like this and Office Live, it seems to me that the industry that needs to be most concerned are the domain name registrars. Many of the services Microsoft is offereing for free are the types of things that reigstrars charge for today. Microsoft is starting to create really impressive productity tools for the small business. And they aren’t charging for these tools. Competitors need to watch out. Thanks Robert and Brian for the tip.",Live.com; Microsoft,2005-11-25 00:00:00
,"Ipod Video Dating, With Tags",https://techcrunch.com/2005/12/03/ipod-video-dating-with-tags/,"PodDater , which launched on November 16, is a video dating site with tagging that focuses on allowing members to download videos of people they are interested in to their iPod. The service is free and allows searching by tag, gender and zip code. It seems like adding an RSS feed for a search is an obvious feature to add, but it’s not there yet. PodDater follows Consumating as an early dating site adopter of tagging.",,2005-12-03 00:00:00
,Wink Launches,https://techcrunch.com/2005/12/22/wink-launches/,"The Wink user-enhanced search engine, in private beta for the last few months, launches Thursday morning to the world. Wink has evolved substantially since my October 12, 2005 review . Wink is, at its core, a combination of traditional search with feature-rich social bookmarking. Bookmarked/tagged results appear above normal search. Search results can be bookmarked, tagged and rated from Wink. The same functionality is available via a bookmarklet that works with Firefox, Safari and IE. As a twist, users can also block “bad” pages. Lots of functional Ajax is built into the interface. Users can easily browse tag results (either their own, or all users). There are three key additional features. First, Wink has added two way synchronization with del.icio.us bookmarks. And they’ve added a “Keep Sync’d” feature that, as the name implies, maintains a constant one or two-way syncronization with del.icio.us. No word on whether they will add in other social bookmarking services over time or not. Second, Wink allows the creation of “collections”, which is a tag group (tags of tags). Collections are controlled by one user but can be shared with anyone. Third, and this feature really appeals to me, Wink has added a “Wink Answers” tab to search results. The text is a wiki – meaning anyone can edit it. For queries that have complicated results, a number of options appear. A lot of data has been pre-populated, and I believe this will be a popular feature. Like Wikipedia, it begs for user interaction, but with a lower intimidation factor. Wink is also finalizing a nice blog widget that includes additional links (that point only to bookmarks created by the blogger). See here for an example. I have not had the opportunity to test this myself yet, but it looks interesting. Congratulations to Founder Michael Tanne and the entire Wink team.",Wink,2005-12-22 00:00:00
,The Hyperwords Plugin,https://techcrunch.com/2005/12/26/the-hyperwords-plugin/,"I generally don’t write about Firefox plugins, but Hyperwords is one that’s gotten my attention. Like Om says, it’s a must-have product to aid the browsing experience. And I see a business model here, too. Hyperwords gives users a number of choices whenever a piece of text is selected. The options simply pop up – right click functionality remains unchanged. Options include searching various engines, looking up text in wikipedia and dictionary.com, emailing text, searching on Google Maps, translation, and searching on Amazon and other commerce sites. The search and commerce traffic will generate revenue (my guess is a dollar or so per year per active user). The translation service is incredibly useful. If you’d like to beta test Hyperwords, email beta@gethyperwords.com.",,2005-12-26 00:00:00
,Omnidrive'S Online Storage Actually Works,https://techcrunch.com/2005/12/25/omnidrives-online-storage-actually-works/,"I’ve been talking to Nik Cubrilovic , the founder of Sydney, Australia based Omnidrive , since I posted about the need for a good online storage service in November (see no. 1 in that post). I’ve had the chance to test it over the last few days. It’s pre-beta but will be launching soon. They’ve solved a lot of the problems associated with storage away from the network, and has both an online and a desktop interface. Omnidrive will have a free version with a gig or so of storage, and paid plans after that. The feature set is awesome – it has everything you could ask for, including dealing with massive file uploads in the background. Full review coming soon – sign up for the beta announcement on the site .",,2005-12-25 00:00:00
,Postsecret Book Arrived,https://techcrunch.com/2005/12/24/postsecret-book-arrived/,"The PostSecret book that I ordered back in October arrived from Amazon. I spent some time going through it last night and I really like it. PostSecret is one of the more interesting Web 2.0 companies (if you can call it a company). It certainly creates conversation, evokes emotion, and merges the online and offline worlds beautifully. If you’d like to buy the book, it is available at Amazon . And speaking of books, check out Om’s free “best of” ebook . Wow, great design by Arno Ghelfi .",PostSecret,2005-12-24 00:00:00
,Browsr Has One Interesting Feature,https://techcrunch.com/2005/12/24/browsr-has-one-interesting-feature/,"I first heard about Browsr in a comment to one of my posts. In some ways it’s a standard bookmarking site, but at this point lacks most of the advanced features of Del.icio.us, Shadows, Wink, etc. But Browsr does have one feature that is interesting. Bookmarks are categorized, and others can rate the usefullness of the bookmark. Browsr then creates a home page directory of the most popular categories and the highest ranked bookmarks within each category. The result is a very nice directory. I like products that take aggregated user data and do something interesting with it. In an indirect way, this reminds me of memeorandum, digg and other useful services that do the same. User date + algorithms (even simple stuff like this) can be incredibly useful.",,2005-12-24 00:00:00
,Talkdigger 2.0,https://techcrunch.com/2005/12/24/talkdigger-20/,"I’m a little late writing about this, but TalkDigger 2.0 , which launched a week and a half ago, has really evolved since the original version that I wrote about back in July . TalkDigger queries major blog (and other) search engines on a given URL and returns relevant results.  Since all of the search engines vary in their results, this is the quickest way to see everything. Enhancements include more search results, more search engines, pagerank for each result, and more. I found an interesting RSS feature in the tools section, for example. And, the results UI is much more user friendly and looks like normal search results. Frédérick Giasson, the creator of TalkDigger, give a full feature overview on his blog .",,2005-12-24 00:00:00
,Outlook 12 To Have Rss Integration,https://techcrunch.com/2005/12/24/outlook-12-to-have-rss-integration/,"In news that certainly is not making the existing RSS Aggregator companies happy, Microsoft Outlook program manager Michael Affronti has soft announced that RSS will be integrated with Outlook 12. This will not only hurt the NewsGators and Attensas of the RSS space (those that have Outlook plugins to display RSS feeds). It will also impact Bloglines and others as users inevitably move their reading habits to the email client. The ability to drag stories right into subject folders, that may or may not contain emails as well, is just too useful to ignore (and that’s why I liked Yahoo’s integration of RSS with email so much a few weeks ago). Robert Scoble also wrote about this, and brings up a very important point. Users want RSS in many different ways (mobile, web when they are away from their home computer, etc.). Syncronization is extremely important and this may be the niche that allows existing players to survive. And I also agree with Robert when he says that RSS integration with Outlook will get millions more people using RSS.",Outlook,2005-12-24 00:00:00
,Gravee Takes A New Approach To Search,https://techcrunch.com/2005/12/21/gravee-takes-a-new-approach-to-search/,"Gravee soft launched tonight. It has an interesting business model. In addition to pulling in search results from Google, MSN and Yahoo (Alexa coming soon), Gravee also allows publishers to claim their site and, theoretically, get a piece of Gravee’s revenue. Here’s how it works : Gravee also shares up to 35% of revenue with publisers that join their affiliate program and place their search box on their site. This will be an interesting way of driving traffic to their site. Site claiming is done via whois information – meaning you must be in control of your domain name to claim the blog. Another way for them to accomplish this would be to ask the site owner to put a piece of code on her/his site, which I imagine they will add at some point.",,2005-12-21 00:00:00
,Oodle Does Add Events/Tickets Category,https://techcrunch.com/2005/12/21/oodle-does-add-eventstickets-category/,"I wrote about this last week – and Oodle now has officially added events and tickets as a category. This seem to be primarily a combination of meetup events and tickets from a number of ticket brokers, including stubhub . There’s lots on money in this space from affiliate fees, so it’s a smart move.",,2005-12-21 00:00:00
,Goodstorm'S Feel Good Capitalism,https://techcrunch.com/2005/12/21/goodstorms-feel-good-capitalism/,"Maybe it’s because it’s the holiday season, but it seems impossible to me not to like San Francisco-based GoodStorm . It’s a competitor to Kleiner-backed Zazzle , and CafePress – basically they let you set up shop and sell items with your logo on it. As with all of these services, they do all the hard work – producing and shipping the item, and collecting the money. All the seller has to do is market the shop, set prices and collect their share of the money. GoodStorm was founded by Yobie Benjamin and August Capital’s Andy Rappaport in October and launched on December 14, 2005 (there are good pictures of the team at that link as well). Their business model is designed to cater specifically to nonprofits. They keep only 30% of the profits on a sale (giving the rest to the seller), and also donate a portion of profits to charity. Like I said, it’s hard not to like this company. Currently they are working with sellers one-one-one, but will eventually launch a self service store creator. The company is built on the Drupal open source content management system. GoodStorm says they will be donating chunks of code back to the project as well. Stefanie Olsen at CNET wrote about Goodstorm earlier this week and has additional information.",Zazzle; Goodstorm; CafePress,2005-12-21 00:00:00
,"Flock Says ""Enough""",https://techcrunch.com/2005/12/21/flock-says-enough/,"Flock has gotten a lot of criticism lately. The reason for this particular round of naysaying is the launch of the impressive Performancing Firefox plugin that allows extremely easy blogging, from Firefox, for WordPress, MovableType or Blogger. Performancing is getting extremely good reviews from top bloggers like Paul Kedrosky , Om Malik and Steve Rubel . But the attacks didn’t start with the release of Performancing. They go way back.  Flock even has its own hate blog (flocksucks.wordpress.com)  (although this one substitutes common cruelty for actual insight and humor). My guess is Flock is suffering from a bit of backlash over its early hype. And my further guess is that Flock, backed by an impressive group of founders and investors, has a few massive tricks up its sleeve that will be announced (or leak out) sometime soon. Until now Flock has done little to fuel all the hype, and have likewise refrained from responding to the criticism. Tonight, however, Flock’s Chris Messina , supported by CEO Bart Decrem , takes issue with some of the bashing. I like this post, and not just because Chris at one point says “jack-in-the-box assclown” or calls web surfing with Firefox extensions “Firefox and Duct tape”.  Chris gives a passionate, if not entirely fact laden, speach on what the hell they are trying to accomplish over at Flock. My last post on Flock, covering its beta launch, is here . Disclaimer: I like Flock and the Flock employees. I get excited about big ideas. And I believe Flock can be a big idea.",Flock,2005-12-21 00:00:00
,V4S – Voicemail For Skype,https://techcrunch.com/2005/12/20/v4s-voicemail-for-skype/,"I read about Orb’s V4S product on Scobelizer and Skype Journal .  V4S is a good, free tool for sending voicemails to Skype and Outlook contacts. V4S joins a whole bunch of products attacking the same or similar market (sending voicemails over the web): YackPack , Odeo  Waxmail , vemail , Springdoo and even the humble slawesome .",Skype,2005-12-20 00:00:00
