subtitle,title,url,text,tags,date
,Jyve,https://techcrunch.com/2005/08/02/jyve/,"Jyve is a set of applications that enhance Skype. I eventually had to tear myself away from the site because I kept finding new tools and features, but the core functionality can be summarized into four categories: As far as I can tell, Jyve is only available for Windows at this time. To use Jyve’s advanced applications, you must be running Skype v.1.3 or later. There is a small (1.3 mb) download. Here is a breakdown of the applications and what they do: You can view these tools here , and a feature showcase here . There are a number of code snippets on this page that you can put on a website and allow website visitors to interact with you in different ways.  For instance, the button below shows whether or not I am online with Skype, and clicking on it calls me (I’m trusting you people not to abuse this button :-)). The tools include CallTO (calls), IMTO (sends an instant message), send voicemail, create conference call, etc. These features will be extremely useful on intranets, wiki’s, etc. There is an “all in one” feature that creates a Jyve/Skype Card for you and that contains all of the features. You can use this tool to share a browser screen with other Skype users. None of my contacts are online right now since it’s the middle of the damn night (even the Jyve guys that I’ve been chatting with, Andrew Hansen and Gabe Morris, are offline – wake up so that we can look at TechCrunch together via Jyve! :-)), so I’m making an assumption that it works. I like this stuff, and I hope that Jyve adds additional productivity tools over time – sharing any application would be perfect. Powerpoint is the obvious one. This is a set of options that will leave auto-responses via IM or voice if you are away, on a call, etc. This is useful. But on a sidenote, I’ve come to the conclusion that it is fine if you don’t respond immediately to an IM – many times people are just sending you some information to consider and don’t necessarily want or expect an immediate response. But I digress… This is the good stuff for me as a user. When a Skype call comes in, you can set it to ring your home phone, forward to a cell phone, or forward to another skype name. Call forwarding requires SkypeOut (a pre-paid thing with skype that allows you to call normal phone numbers). This is really really cool. The only problem is that you must be logged in to Skype for it to work, and the time I most need calls forwarded is when I’m offline. This is a Skype issue, not a Jyve issue, and I’m sure Jyve will change this if/when Skype adds the functionality. That’s it! Like I said, there is lots of other functionality on the site but this seems to be the main group of applications. For heave Skype users, Jyve is a wonderful product. And it is clear that they intend to evolve these products, and release new ones, in the future. Additional Links:  Tom Keating , Tris Hussey , Stuart Henshall #1 , Stuart Henshall #2 , Stuart Henshall #3 , Stuart Henshall #4 , Stuart Henshall #5 , Stowe Boyd , 23corner , Fred on Something , Jan in Malaysia , Mobile Weblog , Soul Soup , Neville Hobson , Connected Internet , Solomon’s VOIP World , Bayens.net , Ton’s Interdependent Thoughts",,2005-08-02 00:00:00
,Meetro,https://techcrunch.com/2005/08/01/profile-meetro/,"Update 9/29/05: Wired published an excellent article on Meetro today. Meetro is an instant messaging service that works both as a stand alone client and also integrates with other IM services (AOL and ICQ for now, others to come later). Meetro determines where you are phyically located automatically (or you can override by telling it manually) and shows you other meetro users near you. It’s a cool way to see when your friends are nearby, and to meet random people who are physically close to you. Meetro currently only works on the Windows platform, with Mac and other clients coming in Q4. The download is small – 3.5 mb, and registration was very simple. Overall, the service works very well. I chatted with two of the founders (Wendell and Paul) and also asked a couple of random people near me what they thought of it – everyone was very enthusiastic and loved the service. This is an application that will stay on my desktop. It will become increasingly useful as they integrate additional IM platforms, as I run five on my desktop currently (MSN, Yahoo, AOL, Skype, Gizmo). Additional Screen Shots:",Meetro,2005-08-01 00:00:00
,Xmhd (Gmail Hard Drive),https://techcrunch.com/2005/08/01/profile-xmhd-gmail-hard-drive/,"XMHD is a service that allows you to use a Google Gmail account as a virtual hard drive. If you don’t have a gmail account (which requires an invitation), don’t worry. They’ll invite you. XMHD is similar to Gmail Drive , which we profiled yesterday. However, whereas Gmail Drive is an actual virtual drive on your Windows machine (and only windows), XMHD runs everything on its website and is therefore platform independent. All you need is a web browser and a gmail account to use it. There is also no account registration or download. Simply give it your gmail credentials and it logs into the gmail account for you and shows you its own front end. In their own words, “How does XmailHardDrive.com work? XmailHardDrive.com directly connects with your Gmail account to then turn it into a portable virtual hard drive that you can access from anywhere in the world.  You simply enter your Gmail username and password, just like the other third party software, and then using the username and password combination it authenticates with the Gmail servers and connects you to your personal account.  Therefore allowing the user to be able to upload files to their Gmail account. Next when the user uploads a file, the file is uploaded as an e-mail attachment in their Gmail inbox, this file however is encrypted and compressed which enables the user to store more files since it is compressed.  The file is then saved as an .xmhd file which can be decompressed and re-downloaded through XmailHardDrive.com.  And now with the FlingIt feature the user can send the file they just uploaded to a friend that has a Gmail account.  Currently the max file upload size is 20mb however as we gain more sponsors we will remove the upload limit, and you’ll be able to upload much much larger files!”  Link You can easily add files from your hard drive (or other connected drive). You can upload up to 10 files at a time. Files are compressed and stored in a proprietary .xmhd format, but can be double clicked and opened in their original format from the site (and saved, edited, etc.). There is also a cool “fling it” feature that emails a file to any gmail contact stored in the gmail account. If the person doens’t have a gmail account, they will have to get one and use xmhd to open the file. All of this is a bit of a hassle for email recipients – and although XMHD says that their file format is necessary for compression purposes (and therefore you can store more data on your gmail account), it is also a nice viral touch to the service because recipients of your file must log in to XMHD to view them. You can always of course, simply email your files directly as well, so its not a big deal and it is a nice feature. We also like the upcoming RSS feed into your XMHD: “XmailHardDrive.com is now in the process of building an RSS feed for your XmailHardDrive, which will allow developers to build applications that interact with your XmailHardDrive. We are also working on a Gmail notifier program capable of so much more than what the Gmail Notifier from Google can do. Stay tuned to the website for when these products will be released.” Link Overall its a great service, completely free, and just a bit better than Gmail Drive due to its cross-platform nature and “fling it” service. Tags: xmhd , xmailharddrive , xmail , gmailharddrive , gmaildrive , google , gmail , storage , techcrunch , web2.0",,2005-08-01 00:00:00
,Profile – Gmail Drive,https://techcrunch.com/2005/07/31/profile-gmail-drive/,"Service:  Gmail Drive Launched: v. 1.0.6 was released on July 27, 2005 What is it? Gmail drive is a service that creates a virtual hard drive folder on your Windows system, accessible through “My Computer”, that allows you to store files in your Gmail email account. The current Gmail storage limitation is 2 gigs. In their own words, “GMail Drive is a Shell Namespace Extension that creates a virtual filesystem around your Google Gmail account, allowing you to use Gmail as a storage medium. GMail Drive creates a virtual filesystem on top of your Google Gmail account and enables you to save and retrieve files stored on your Gmail account directly from inside Windows Explorer. GMail Drive literally adds a new drive to your computer under the My Computer folder, where you can create new folders, copy and drag’n’drop files to. Ever since Google started to offer users a Gmail e-mail account, which includes storage space of 2000 megabytes, you have had plenty of storage space but not a lot to fill it up with. With GMail Drive you can easily copy files to your Gmail account and retrieve them again. When you create a new file using GMail Drive, it generates an e-mail and posts it to your account. The e-mail appears in your normal Inbox folder, and the file is attached as an e-mail attachment. GMail Drive periodically checks your mail account (using the Gmail search function) to see if new files have arrived and to rebuild the directory structures. But basically GMail Drive acts as any other hard-drive installed on your computer. You can copy files to and from the GMail Drive folder simply by using drag’n’drop like you’re used to with the normal Explorer folders.” Link The service works as promised. After a quick download and installation, it installs a virtual gmail hard drive on your system, accessible through “My Computer”.  You can then drag and drop files into the drive. I tested out dragging and dropping files, and it worked well (if understandably a little slow – a 1.5 mb file took about 20 seconds to fully copy over. Individual files cannot be bigger than 10 mb or have file names longer than 40 characters (gmail limitations). We’ll also be profiling xmail hard drive , a similar service that is web-based, and so platform independent. (via downloadsquad ) Creator: bjarke Additional Links:  LifeHacker , Technoogle , Digg , Richard Jones (we love the .name domain name), Joe Bardi , unknown , brokenkode , mobileread , greenportal , Achieve IT , MikeTechShow , Jackolsden , polymercode , foudebassan , big idea , Dan’s Blog , AppalachianGunTrash , Cyberia , DaveWolf , SolitaryBird Tags:  gmailharddrive , gmaildrive , gmail , xmail , storage , google , email , techcrunch , web2.0",,2005-07-31 00:00:00
,Profile – Blinklist,https://techcrunch.com/2005/07/31/profile-blinklist/,"Update: I really like the way Microcontent Musings breaks down web services into core web 2.0 functions. While it can be a little harsh, it’s also a nice “to do” list for new companies. BlinkList is only a month old…my bet is that in another month or so they will do significantly better than 1/10. :-) Company: BlinkList (a MindValley company) Launched: June 2005. Major feature release July 25, 2005 Location: Office in San Jose, CA : Mike Reining (Director) MindValley LC 236 W. Rincon Ave #B Campbell, California, 95008 USA Tel: (650) 387 0920 Office in Kuala Lumpur : Vishen Lakhiani (Director) MindValley LC Fabrikus Building No.1, Jln 8-91, Taman Shamelin Perkasa, Cheras, 56100 Kuala Lumpur, Malaysia Tel: (+603) 9283 6054 What is it? BlinkList is a social bookmarking service built on ajax.  It is very buttoned up and has some excellent features. It also has an all-star team with deep experience, led by their PR star (see team below) :-). We’ve profiled a number of competing services lately – see Shadows , del.icio.us , Simpy , Furl , Yahoo My Web 2.0  and  others . Blinklist includes most of the features from those sites, and adds a couple of others. Key Features: – easy bookmarking, including a bookmarklet if you want to have one-click bookmarks – adding “stars” to tags and bookmarks to easily find them in the future – Blinklist will take any highlighted text on the screen and auto fill a description field with the text (this is the only service I know of that does this, and it’s incredibly useful) – bookmarks can be private or public. You can email bookmarks to friends at the time of making them, which is also a very useful feature. TechCrunch bookmarks are here . – permanent tag pages – see for example www.blinklist.com/tag/web2.0/ (a nested/filtered search function on general tag search would be an awesome addition – Shadows has a “narrow results” option that is very useful) – a tag cloud for each user, as well as the entire blinklist community – “related tags” for currently viewed tags – “auto-complete” suggestions when tagging a bookmark – RSS for all pages – easy signup see the demo here to see some of these features being used. Overall, BlinkList is a worthy addition to the ranks of social bookmarking services, and one of our favorites. It doesn’t have the user base of del.cio.us, or all of the functionality of Shadows or Simpy, but it does have unique features that none of the others have. It could very easily get traction. Suggested new features: – full page caching with keyword search – shadow-page type functionality (this is going to really help with search engine rankings for Pluck, and it’s cool). – nested/tag filtering at all levels – show number of people who’ve bookmared a given URI Additional Screen Shots: Team: Vishen M. Lakhiani – Co-Founder Michael Reining – Co-Founder Kristina Mand – Book Balancer Adelle Magsombol – Business Development Manager Jiangti Wan Leong – Chief Web Developer Hannu Nikupeteri – Database Engineer Anita Patwardhan – Web Analytics and eCommerce Consultant Amar H. Hamzeh – Code Wiz Ozzy Labradoodle – Director of Public Relations ( “When he’s not chewing on our laptop cables, he’s in charge of PR” ) Link Additional Links:  MindValley , Discussion Group , MindValley Blog , RetroType , Mad Baggage , Jill Adelle , Blended Edu , IT Sideways , strategiczero , EduBlog , Republic of Geektronica , Christian Contini Tags:  blinklist , mindvalley , delicious , del.icio.us , simpy , furl , shadows , socialbookmarking , rss , atom , web2.0 , techcrunch , tags , tagging , folksonomy",,2005-07-31 00:00:00
,Update – Icerocket (Name Change),https://techcrunch.com/2005/07/31/update-icerocket-name-change/,"Company: IceRocket Previous Profile:  July 29, 2005 What’s New? We wrote in our previous profile on IceRocket that they were changing their name to BlogScour (based on something Mark Cuban said at AlwaysOn). Blake Rhodes, IceRocket’s CEO, called to tell me that our facts were not quite right (he also thanked us for the post). They are not going to change their name to BlogScour, but they are going to launch a site called BlogScour that will contain all of their blog search capabilities. I saw this at Blogherald a few minutes ago (I cannot locate the mentioned SEW article), and emailed Blake to confirm the facts. He confirmed what he told me on Friday – “Mike- We WILL launch a site called Blogscour.com. I dont have a date for that. Basically it will be our blog search we currently have minus all the web and image search features we have on IceRocket currently. It is going to be blogs only. Have a great evening. Blake” So there you have it. Personally, I don’t give a damn, I just love their search engine. They could call it searchcrap.com and we’d still use it twenty times a day to research companies. Tags:  icerocket , search , blogscour , techcrunch , web2.0 , blogsearch , rsssearch , rss",IceRocket,2005-07-31 00:00:00
,Profile – Talk Digger,https://techcrunch.com/2005/07/31/profile-talk-digger/,"What is it? TalkDigger queries major blog (and other) search engines on a given URL and returns total number of links in to the site as well as other data. Clicking on the total link number takes you to the selected search engine results. “There are 3 specifics things that will appear when you dig for a link: 1. Result. This is the number of links to that URL. If you click on that blue number, you will be redirected to the result page of the search engine and be able to know who links to you 2. Trend. This is an arrow that will shows you if the number of results for that search is higher, lower or the same as the previous one. This is really effective when you wake up the morning and that you need to instantly see if someone as talked about your blog during the night 3. 7 last digs trend graph. This is a graph that shows you the evolution of the results returned by the search engines in the last 7 search requests” Link It’s a useful tool for doing ego searches as well as for generally comparing the search sites on total number of links in their respective indexes for any given query. Nice tool. (via Scoble , Steve Rubel and Blog Herald ) Additional Links:  FrÃ©dÃ©rick Giasson , FrÃ©dÃ©rick Giasson #2 (bookmarklet), Hugo E. Martin , Somewhat Frank , jotsheet , Technoogle , Tim Yang , Matthew Hurst , Library Clips , Library Stuff , License to Roam Tags: Links , Search , AJAX , , Popularity , Bloglines , Technorati , IceRocket , Feedster , PubSub , , BlogPulse , Scoble , techcrunch , web2.0 , talkdigger , rsssearch , blogsearch , google , msn , blogdigger",TalkDigger,2005-07-31 00:00:00
